{
  "input_pdb": "/home/luod/ProteinCraft/run/4_PD-L1/outs_RING/try1_7_dldesign_0_cycle1_af2pred.pdb_ring",
  "contigs": [
    "19-19/A20-20/2-2/A23-23/13-13/A37-37/2-2/A40-41/1-1/A43-43/46-46/0",
    "B1-116"
  ],
  "hotspot_res": ["A56", "A115", "A123"],
  "noise_scale": {
    "ca": 0.0,
    "frame": 0.0
  },
  "num_designs": 10,
  "pbonds": [
    {
      "res1": "A:23:SER",
      "res2": "B:36:ALA",
      "atom1": "OG",
      "atom2": "O",
      "interaction": "HBOND:SC_MC"
    },
    {
      "res1": "A:43:LYS",
      "res2": "B:42:GLU",
      "atom1": "NZ",
      "atom2": "OE2",
      "interaction": "HBOND:SC_SC"
    },
    {
      "res1": "A:20:THR",
      "res2": "B:53:HIS",
      "atom1": "OG1",
      "atom2": "ND1",
      "interaction": "HBOND:SC_SC"
    },
    {
      "res1": "A:40:TYR",
      "res2": "B:97:ARG",
      "atom1": "-1.498,17.367,-15.405",
      "atom2": "CZ",
      "interaction": "PICATION:SC_SC"
    },
    {
      "res1": "A:23:SER",
      "res2": "B:101:SER",
      "atom1": "O",
      "atom2": "OG",
      "interaction": "HBOND:MC_SC"
    },
    {
      "res1": "A:41:PHE",
      "res2": "B:107:TYR",
      "atom1": "-7.588,12.791,-17.314",
      "atom2": "-9.117,16.805,-14.161",
      "interaction": "PIPISTACK:SC_SC"
    },
    {
      "res1": "A:37:TYR",
      "res2": "B:107:TYR",
      "atom1": "-7.332,19.971,-16.656",
      "atom2": "-9.117,16.805,-14.161",
      "interaction": "PIPISTACK:SC_SC"
    }
  ]
}
